{
    "$schema": "http://json-schema.org/draft-04/schema#",
    "type": "object",
    "required": ["stavba"],
    "properties": {
        "stavba": {
            "type": "object",
            "required": ["naziv", "lokacija", "KO", "parcele", "klasifikacija"],
            
            "properties": {
                "naziv": {"type": "string"},
                "lokacija": {"type": "string"},
                "KO": {"type": "string"},
                "parcele": {"type": "array", "minItems": 1},
                "klasifikacija": {"type": "string"}
            }
        },
        "investitorji": {
            "type": "array",
            "minItems": 1,
            "items": {
                "type": "object",
                "required": ["naziv", "naslov"]
            }
        },
        "zunanjiHrup": {
            "type": "object",
            "properties": {
                "kazalciHrupa": {"enum": ["obmocje", "lastni"]},
                "obmocje": {"enum": ["I", "II", "III", "IV"]}
            }
        },
        "vodjaProjektiranja": {"type": "string"},
        "izdelovalec": {"type": "string"},
        "stevilkaElaborata": {"type": "string"},
        "datum": {"type": "string"}
    }
}