{
    "stavba": {
        "naziv": "Testni Projekt",
        "lokacija": "Mestna cesta 12",
        "KO": "Ljubljana",
        "parcele": [
            "123/4"
        ],
        "koordinate": {
            "X": 116215,
            "Y": 469925
        },
        "klasifikacija": "11100",
        "vrsta": "manjzahtevna",
        "notranjaTemp": 20
    },
    "investitorji": [
        {
            "naziv": "Janez Novak",
            "naslov": "Mestna cesta 12, 1000 Ljubljana"
        }
    ],
    "vodjaProjektiranja": "Franc Pavlin, udia, ZAPS 1122",
    "izdelovalec": "Franc Pavlin, udia, ZAPS 1122",
    "datum": "april 2023"
}